27,Aston Martin Back,Image of an Aston Martin from the back,gallery,gal-aston-back.jpg,6,3
28,Aston Martin Front,Image of an Aston Martin from the front,gallery,gal-aston-front.jpg,6,3
29,Audi TT,Image of an Audi TT,gallery,gal-audi-tt.jpg,6,3
30,Busy Engineer,Image of an engineer from Fast Mot,gallery,gal-busy-engineer.jpg,6,3
31,Busy Garage,Image of Fast Mot garage during busy hours,gallery,gal-busy-garage.jpg,6,3
32,Checklist,Image of an engineer from Fast Mot checking of list,gallery,gal-checklist.jpg,6,3
33,Corvette from the back,Image of a Corvette from the back,gallery,gal-corvette-back.jpg,6,3
34,Corvette from the front,Image of a Corvette from the front,gallery,gal-corvette-front.jpg,6,3
35,Engineer,Image of an engineer,gallery,gal-engineer.jpg,6,3
36,Fast Mot's reception,Image of the reception area at fast mot,gallery,gal-fastmot-reception.jpg,6,3
37,Ford Fiesta,Image of white Ford Fiesta,gallery,gal-ford-fiesta.jpg,6,3
38,Ford Mustang Back,Image of yellow Ford Mustang from the back,gallery,gal-ford-mustang-back.jpg,6,3
39,Maserati Back,Image of Maserati from the back,gallery,gal-maserati-back.jpg,6,3
40,Maserati Front,Image of Maserati from the front,gallery,gal-maserati-front.jpg,6,3
41,White Mini Cooper,Image of a white Mini Cooper,gallery,gal-mini-cooper-white.jpg,6,3
42,Blue and White Mini Coopers,Image of blue and white Mini Coopers,gallery,gal-minis.jpg,6,3
43,Engineer working on Aston Martin,Image of a Fast Mot's engineer performing a fault test on an Aston Martin,gallery,gal-mot-aston.jpg,6,3
44,Old blue car,Image of a old car,gallery,gal-old-car.jpg,6,3
45,Outside of Fast Mot,Outside of the Fast Mot garage,gallery,gal-outside-garage.jpg,6,3
46,White Porsche,Image of white Porsche,gallery,gal-porsche.jpg,6,3
47,"TVR and Nissan 350Z" ,"Image of TVR Chimaeram and Nissan 350Z",gallery,gal-tvrandz350.jpg,6,3
48,Engineer inspection ,An engineer carrying out routine inspection under a vehicle,gallery,gal-under-vehicle-inspection.jpg,6,3
49,Engineer inspecting under vehicle ,An engineer carrying out routine inspection under a vehicle drive train,gallery,"gal-under-vehicle-inspection2.jpg",6,3